{
  "version": "0.3.0",
  "schemaVersion": "0.0.2",
  "name": "RADAR MSDep RegionH s1",
  "healthIssues": ["depression"],
  "protocols": [
    {
      "name": "THINC-IT",
      "showIntroduction": false,
      "showInCalendar": true,
      "isDemo": false,
      "order": 2,
      "questionnaire": {
        "repository": "https://raw.githubusercontent.com/RADAR-base/RADAR-REDCap-aRMT-Definitions/master/questionnaires/",
        "name": "thinc_it",
        "avsc": "notification"
      },
      "startText": {
        "en": "",
        "it": "",
        "nl": "",
        "da": "",
        "de": "",
        "es": ""
      },
      "endText": {
        "en": "",
        "it": "",
        "nl": "",
        "da": "",
        "de": "",
        "es": ""
      },
      "warn": {
        "en": "Requires a quiet space.",
        "it": "Richiede uno spazio tranquillo.",
        "nl": "Vereist een rustige ruimte.",
        "da": "Kræver et stille rum.",
        "de": "Benötigt einen ruhigen Platz.",
        "es": "Requiere un espacio tranquilo."
      },
      "estimatedCompletionTime": 1,
      "protocol": {
        "repeatProtocol": {
          "unit": "day",
          "amount": 42
        },
        "repeatQuestionnaire": {
          "unit": "min",
          "unitsFromZero": [660]
        },
        "reminders": {
          "unit": "day",
          "amount": 0,
          "repeat": 0
        }
      }
    },
    {
      "name": "PHQ8",
      "showIntroduction": true,
      "showInCalendar": true,
      "isDemo": false,
      "order": 1,
      "questionnaire": {
        "repository": "https://raw.githubusercontent.com/RADAR-base/RADAR-REDCap-aRMT-Definitions/master/questionnaires/",
        "name": "phq8",
        "avsc": "questionnaire"
      },
      "startText": {
        "en": "",
        "it": "",
        "nl": "",
        "da": "",
        "de": "",
        "es": ""
      },
      "endText": {
        "en": "",
        "it": "",
        "nl": "",
        "da": "",
        "de": "",
        "es": ""
      },
      "warn": {
        "en": "",
        "it": "",
        "nl": "",
        "da": "",
        "de": "",
        "es": ""
      },
      "estimatedCompletionTime": 1,
      "protocol": {
        "repeatProtocol": {
          "unit": "day",
          "amount": 42
        },
        "repeatQuestionnaire": {
          "unit": "min",
          "unitsFromZero": [690]
        },
        "reminders": {
          "unit": "day",
          "amount": 0,
          "repeat": 0
        },
        "completionWindow": {
          "unit": "day",
          "amount": 3
        }
      }
    },
    {
      "name": "DEMO ESM",
      "showIntroduction": false,
      "showInCalendar": true,
      "isDemo": true,
      "order": 5,
      "questionnaire": {
        "repository": "https://raw.githubusercontent.com/RADAR-CNS/RADAR-REDCap-aRMT-Definitions/master/questionnaires/",
        "name": "esm-demo",
        "avsc": "questionnaire"
      },
      "startText": {
        "en": "",
        "it": "",
        "nl": "",
        "da": "",
        "de": "",
        "es": ""
      },
      "endText": {
        "en": "",
        "it": "",
        "nl": "",
        "da": "",
        "de": "",
        "es": ""
      },
      "warn": {
        "en": "",
        "it": "",
        "nl": "",
        "da": "",
        "de": "",
        "es": ""
      },
      "estimatedCompletionTime": 3,
      "protocol": {
        "repeatProtocol": {
          "unit": "year",
          "amount": 9999
        },
        "repeatQuestionnaire": {
          "unit": "min",
          "unitsFromZero": [540]
        },
        "reminders": {
          "unit": "day",
          "amount": 0,
          "repeat": 0
        }
      }
    },
    {
      "name": "PDDS",
      "showIntroduction": false,
      "showInCalendar": true,
      "isDemo": false,
      "order": 0,
      "questionnaire": {
        "repository": "https://raw.githubusercontent.com/RADAR-base/RADAR-REDCap-aRMT-Definitions/master/questionnaires/",
        "name": "patient_determined_disease_step",
        "avsc": "questionnaire"
      },
      "startText": {
        "en": "",
        "it": "",
        "nl": "",
        "da": "",
        "de": "",
        "es": ""
      },
      "endText": {
        "en": "",
        "it": "",
        "nl": "",
        "da": "",
        "de": "",
        "es": ""
      },
      "warn": {
        "en": "",
        "it": "",
        "nl": "",
        "da": "",
        "de": "",
        "es": ""
      },
      "estimatedCompletionTime": 1,
      "protocol": {
        "repeatProtocol": {
          "unit": "day",
          "amount": 42
        },
        "repeatQuestionnaire": {
          "unit": "min",
          "unitsFromZero": [630]
        },
        "reminders": {
          "unit": "day",
          "amount": 0,
          "repeat": 0
        }
      }
    },
    {
      "name": "AUDIO_4",
      "showIntroduction": false,
      "order": 3,
      "questionnaire": {
        "repository": "https://raw.githubusercontent.com/RADAR-CNS/RADAR-REDCap-aRMT-Definitions/master/questionnaires/",
        "name": "audio_4",
        "avsc": "questionnaire"
      },
      "startText": {
        "en": "",
        "it": "",
        "nl": "",
        "da": "",
        "de": "",
        "es": ""
      },
      "endText": {
        "en": "",
        "it": "",
        "nl": "",
        "da": "",
        "de": "",
        "es": ""
      },
      "warn": {
        "en": "Find a quiet space.",
        "it": "Trova uno spazio tranquillo.",
        "nl": "Zoek een stille ruimte.",
        "da": "Find et roligt sted.",
        "de": "Suchen Sie sich einen ruhigen Platz.",
        "es": "Encuentra un espacio tranquilo."
      },
      "estimatedCompletionTime": 3,
      "protocol": {
        "repeatProtocol": {
          "unit": "day",
          "amount": 42
        },
        "repeatQuestionnaire": {
          "unit": "min",
          "unitsFromZero": [690]
        },
        "reminders": {
          "unit": "day",
          "amount": 0,
          "repeat": 0
        },
        "completionWindow": {
          "unit": "day",
          "amount": 3
        }
      }
    }
  ]
}
