{
  "version": "0.2.5",
  "schemaVersion": "0.0.2",
  "name": "RADAR MDD KCL s1",
  "healthIssues": ["depression"],
  "protocols": [
    {
      "name": "THINC-IT",
      "showIntroduction": false,
      "questionnaire": {
        "repository": "https://raw.githubusercontent.com/RADAR-base/RADAR-REDCap-aRMT-Definitions/master/questionnaires/",
        "name": "thinc_it",
        "avsc": "notification"
      },
      "startText": {
        "en": "",
        "it": "",
        "nl": "",
        "da": "",
        "de": "",
        "es": ""
      },
      "endText": {
        "en": "",
        "it": "",
        "nl": "",
        "da": "",
        "de": "",
        "es": ""
      },
      "warn": {
        "en": "Requires a quiet space.",
        "it": "Richiede uno spazio tranquillo.",
        "nl": "Vereist een rustige ruimte.",
        "da": "Kræver et stille rum.",
        "de": "Benötigt einen ruhigen Platz.",
        "es": "Requiere un espacio tranquilo."
      },
      "estimatedCompletionTime": 1,
      "protocol": {
        "repeatProtocol": {
          "unit": "day",
          "amount": 42
        },
        "repeatQuestionnaire": {
          "unit": "min",
          "unitsFromZero": [660]
        },
        "reminders": {
          "unit": "day",
          "amount": 0,
          "repeat": 0
        }
      }
    },
    {
      "name": "PHQ8",
      "showIntroduction": false,
      "questionnaire": {
        "repository": "https://raw.githubusercontent.com/RADAR-base/RADAR-REDCap-aRMT-Definitions/master/questionnaires/",
        "name": "phq8",
        "avsc": "questionnaire"
      },
      "startText": {
        "en": "This questionnaire is known as the PHQ8. Clinicians use it to assess current depression in patients. Please note that none of your answers will be collected today. Thank you for taking part in this focus group.",
        "it": "",
        "nl": "",
        "da": "",
        "de": "",
        "es": ""
      },
      "endText": {
        "en": "Thank you for taking the time today.",
        "it": "",
        "nl": "",
        "da": "",
        "de": "",
        "es": ""
      },
      "warn": {
        "en": "",
        "it": "",
        "nl": "",
        "da": "",
        "de": "",
        "es": ""
      },
      "estimatedCompletionTime": 3,
      "protocol": {
        "repeatProtocol": {
          "unit": "day",
          "amount": 14
        },
        "repeatQuestionnaire": {
          "unit": "min",
          "unitsFromZero": [570]
        },
        "reminders": {
          "unit": "day",
          "amount": 0,
          "repeat": 0
        },
        "completionWindow": {
          "unit": "day",
          "amount": 3
        }
      }
    },
    {
      "name": "RSES",
      "showIntroduction": false,
      "questionnaire": {
        "repository": "https://raw.githubusercontent.com/RADAR-base/RADAR-REDCap-aRMT-Definitions/master/questionnaires/",
        "name": "rses",
        "avsc": "questionnaire"
      },
      "startText": {
        "en": "",
        "it": "",
        "nl": "",
        "da": "",
        "de": "",
        "es": ""
      },
      "endText": {
        "en": "",
        "it": "",
        "nl": "",
        "da": "",
        "de": "",
        "es": ""
      },
      "warn": {
        "en": "",
        "it": "",
        "nl": "",
        "da": "",
        "de": "",
        "es": ""
      },
      "estimatedCompletionTime": 3,
      "protocol": {
        "repeatProtocol": {
          "unit": "day",
          "amount": 14
        },
        "repeatQuestionnaire": {
          "unit": "min",
          "unitsFromZero": [600]
        },
        "reminders": {
          "unit": "day",
          "amount": 0,
          "repeat": 0
        },
        "completionWindow": {
          "unit": "day",
          "amount": 3
        }
      }
    },
    {
      "name": "DEMO",
      "showIntroduction": true,
      "questionnaire": {
        "repository": "https://raw.githubusercontent.com/RADAR-base/RADAR-REDCap-aRMT-Definitions/master/questionnaires/",
        "name": "esm-demo",
        "avsc": "questionnaire"
      },
      "startText": {
        "en": "",
        "it": "",
        "nl": "",
        "da": "",
        "de": "",
        "es": ""
      },
      "endText": {
        "en": "",
        "it": "",
        "nl": "",
        "da": "",
        "de": "",
        "es": ""
      },
      "warn": {
        "en": "",
        "it": "",
        "nl": "",
        "da": "",
        "de": "",
        "es": ""
      },
      "estimatedCompletionTime": 3,
      "protocol": {
        "repeatProtocol": {
          "unit": "year",
          "amount": 9999
        },
        "repeatQuestionnaire": {
          "unit": "min",
          "unitsFromZero": [540]
        },
        "reminders": {
          "unit": "day",
          "amount": 0,
          "repeat": 0
        }
      }
    },
    {
      "name": "AUDIO",
      "showIntroduction": false,
      "questionnaire": {
        "repository": "https://raw.githubusercontent.com/RADAR-base/RADAR-REDCap-aRMT-Definitions/master/questionnaires/",
        "name": "audio",
        "avsc": "questionnaire"
      },
      "startText": {
        "en": "",
        "it": "",
        "nl": "",
        "da": "",
        "de": "",
        "es": ""
      },
      "endText": {
        "en": "",
        "it": "",
        "nl": "",
        "da": "",
        "de": "",
        "es": ""
      },
      "warn": {
        "en": "Find a quiet space.",
        "it": "Trova uno spazio tranquillo.",
        "nl": "Zoek een stille ruimte.",
        "da": "Find et roligt sted.",
        "de": "Suchen Sie sich einen ruhigen Platz.",
        "es": "Encuentra un espacio tranquilo."
      },
      "estimatedCompletionTime": 3,
      "protocol": {
        "repeatProtocol": {
          "unit": "day",
          "amount": 42
        },
        "repeatQuestionnaire": {
          "unit": "min",
          "unitsFromZero": [690]
        },
        "reminders": {
          "unit": "day",
          "amount": 0,
          "repeat": 0
        },
        "completionWindow": {
          "unit": "day",
          "amount": 3
        }
      }
    },
    {
      "name": "AUDIO_2",
      "showIntroduction": false,
      "questionnaire": {
        "repository": "https://raw.githubusercontent.com/RADAR-base/RADAR-REDCap-aRMT-Definitions/master/questionnaires/",
        "name": "audio_2",
        "avsc": "questionnaire"
      },
      "startText": {
        "en": "",
        "it": "",
        "nl": "",
        "da": "",
        "de": "",
        "es": ""
      },
      "endText": {
        "en": "",
        "it": "",
        "nl": "",
        "da": "",
        "de": "",
        "es": ""
      },
      "warn": {
        "en": "Find a quiet space.",
        "it": "Trova uno spazio tranquillo.",
        "nl": "Zoek een stille ruimte.",
        "da": "Find et roligt sted.",
        "de": "Suchen Sie sich einen ruhigen Platz.",
        "es": "Encuentra un espacio tranquilo."
      },
      "estimatedCompletionTime": 3,
      "protocol": {
        "repeatProtocol": {
          "unit": "day",
          "amount": 42
        },
        "repeatQuestionnaire": {
          "unit": "min",
          "unitsFromZero": [20850]
        },
        "reminders": {
          "unit": "day",
          "amount": 0,
          "repeat": 0
        },
        "completionWindow": {
          "unit": "day",
          "amount": 3
        }
      }
    },
    {
      "name": "AUDIO_3",
      "showIntroduction": false,
      "questionnaire": {
        "repository": "https://raw.githubusercontent.com/RADAR-base/RADAR-REDCap-aRMT-Definitions/master/questionnaires/",
        "name": "audio_3",
        "avsc": "questionnaire"
      },
      "startText": {
        "en": "",
        "it": "",
        "nl": "",
        "da": "",
        "de": "",
        "es": ""
      },
      "endText": {
        "en": "",
        "it": "",
        "nl": "",
        "da": "",
        "de": "",
        "es": ""
      },
      "warn": {
        "en": "Find a quiet space.",
        "it": "Trova uno spazio tranquillo.",
        "nl": "Zoek een stille ruimte.",
        "da": "Find et roligt sted.",
        "de": "Suchen Sie sich einen ruhigen Platz.",
        "es": "Encuentra un espacio tranquilo."
      },
      "estimatedCompletionTime": 3,
      "protocol": {
        "repeatProtocol": {
          "unit": "day",
          "amount": 42
        },
        "repeatQuestionnaire": {
          "unit": "min",
          "unitsFromZero": [41010]
        },
        "reminders": {
          "unit": "day",
          "amount": 0,
          "repeat": 0
        },
        "completionWindow": {
          "unit": "day",
          "amount": 3
        }
      }
    }
  ]
}
